School URN,School name,School address,School point of contact name,School point of contact email,Estimate number of ECTs,Delivery partner
21942,(Acle) Marshes Children's Centre,"Bridewell Lane, Acle, Norfolk, NR13 3RA",Bob Hoskins,bob.hoskins@bridewell.com,6,ABC Limited
20007,16-19 Abingdon,"1A Rosebery Avenue, London, Not applicable, EC1R 4SR",Grace Kelly,grace@roseberry.co.uk,1,CDE Inc
20008,1st Place Children and Parents' Centre,"Burgess Park, Chumleigh Street, London, Not applicable, SE5 0RN",Mike Tyson,mtyson@park.park.uk,3,FGH and company
134909,3 Dimensions,"Chardleigh House, Chardleigh Green, Wadeford, Chard, Somerset, TA20 3AJ",Anna Anderson,aanderson@school.edu.uk,6,Smith and sons
20009,3R1 Abbots Langley Family Centre,"School Mead, Abbots Langley, Hertfordshire, WD5 0LB",Carl Carlson,carslon@info.school.com,4,Top Teaching
20010,3R2 Croxley Green Family Centre,"Dulwich Way, Croxley Green, Rickmansworth, Hertfordshire, WD3 3PX",Eddy Eddison,eddison.ed@schools.dulwich.com,5,Education Ltd
20011,3R3 Rickmansworth Family Centre,"Wartnaby Road, Ab Kettleby, Melton Mowbray, Leicestershire, LE14 3JJ",Fran Francis,fran.francis@edu.gov.co.uk,14,Learning Co.